{
  "id": "dir_founder",
  "statement": "Build the local-first operating system for sovereign creators.",
  "horizon": "the next 12 months",
  "themes": ["local-first", "sovereignty", "agentic systems"],
  "values": ["generosity", "reliability"],
  "createdAt": "2026-06-20T00:00:00.000Z",
  "updatedAt": "2026-07-01T00:00:00.000Z"
}
